url,url_mobile,title,seendate,socialimage,domain,language,sourcecountry,theme_id,theme_description
https://tass.ru/armiya-i-opk/23623389,https://tass.ru/armiya-i-opk/23623389/amp,В Минобороны создадут мобильные врачебные комиссии,20250408T070000Z,https://cdn-storage-media.tass.ru/thumb/ru/armiya-i-opk/23623389?u=2025-04-08T06:05:26.364994,tass.ru,Russian,Russia,MEDICAL,Medical topics and healthcare
https://www.interfax.ru/russia/1018735,https://www.interfax.ru/amp/1018735,В Минобороны будут созданы мобильные врачебные комиссии,20250408T063000Z,https://www.interfax.ru/aspimg/1018735.png,interfax.ru,Russian,Russia,MEDICAL,Medical topics and healthcare
https://1prime.ru/20250409/senator-856495849.html,https://1prime.ru/amp/20250409/senator-856495849.html,Сенатор попросил ФАС запретить снижение стоимости охранных услуг для школ,20250409T054500Z,https://cdnn.1prime.ru/images/sharing/article/rus/856495849.jpg,1prime.ru,Russian,Russia,SECURITY_SERVICES,Security and law enforcement services
https://komiinform.ru/news/279279,,Росгвардией Коми за минувшую неделю изъято две единицы оружия,20250414T140000Z,https://komiinform.ru/content/news/images/279279/IMG_3005_list.jpg,komiinform.ru,Russian,Russia,SECURITY_SERVICES,Security and law enforcement services
https://mignews.com/news/arabisrael/smi-poselency-atakovali-beduinov-v-iudee-i-samarii-arestovan-palestinec.html,,СМИ : Поселенцы атаковали бедуинов в Иудее и Самарии . Арестован палестинец | MigNews - Новости Израиля и Мира на русском языке,20250422T073000Z,https://mignews.com/media/cache/2e/2b/2e2ba27838276eb06e59f634f7c8a274.jpg,mignews.com,Russian,,SECURITY_SERVICES,Security and law enforcement services
http://mignews.com/news/arabisrael/smi-poselency-atakovali-beduinov-v-iudee-i-samarii-arestovan-palestinec.html,,СМИ : Поселенцы атаковали бедуинов в Иудее и Самарии . Арестован палестинец | MigNews - Новости Израиля и Мира на русском языке,20250422T074500Z,https://mignews.com/media/cache/2e/2b/2e2ba27838276eb06e59f634f7c8a274.jpg,mignews.com,Russian,,SECURITY_SERVICES,Security and law enforcement services
http://mignews.com/news/politic/maariv-v-sluzhbah-bezopasnosti-potryaseny-naznacheniem-novogo-glavy-shabak.html,,Маарив : в службах безопасности потрясены назначением нового главы ШАБАК | MigNews - Новости Израиля и Мира на русском языке,20250331T074500Z,https://mignews.com/media/cache/7a/dd/7add88fe4287a78552b8ecc18f8a84f6.jpg,mignews.com,Russian,,SECURITY_SERVICES,Security and law enforcement services
https://kazpravda.kz/n/yurlitsa-obyazhut-sdavat-oruzhie-na-hranenie-v-ovd-v-sluchae-priostanovleniya-deyatelnosti/,,Юрлица обяжут сдавать оружие на хранение в ОВД в случае приостановления деятельности,20250402T110000Z,https://example.com/image.jpg,kazpravda.kz,Russian,Kazakhstan,SECURITY_SERVICES,Security and law enforcement services
https://www.newsru.co.il/israel/23apr2025/kortezh323.html,https://www.newsru.co.il/israel/23apr2025/kortezh323.html/amp/,Нетаниягу опоздал на церемонию Дня памяти Холокоста из - за подозрительного дрона,20250423T224500Z,https://images.newsru.co.il/l/227/29/2272965.jpg?cb=1745435515,newsru.co.il,Russian,Israel,SECURITY_SERVICES,Security and law enforcement services
https://www.cnews.ru/news/top/2025-04-23_arestovan_vtoroj_figurant,,Арестован глава департамента цифрового развития и защиты информации Росгвардии по делу о мошенничестве с ИТ - проектами,20250423T111500Z,https://static.cnews.ru/img/news/2025/04/23/rg_700.jpg,cnews.ru,Russian,Russia,SECURITY_SERVICES,Security and law enforcement services
https://www.newsru.co.il/israel/21apr2025/niftar501.html,https://www.newsru.co.il/israel/21apr2025/niftar501.html/amp/,"27 - летний мужчина , потерявший сознание во время пробежки , скончался в больнице",20250421T131500Z,https://images.newsru.co.il/l/227/22/2272297.jpg?cb=1745223504,newsru.co.il,Russian,Israel,SECURITY_SERVICES,Security and law enforcement services
https://www.amic.ru/news/deputat-gd-s-altaya-obyasnila-kak-ocenka-za-povedenie-uchenika-povliyaet-na-reyting-shkoly-561376,https://www.amic.ru/amp/news/561376,Как оценка за поведение ученика повлияет на рейтинг школы ? ,20250424T111500Z,https://www.amic.ru/images/news/webp/561376_size1.webp,amic.ru,Russian,Russia,AFFECT,Emotional affect and sentiment
https://iz.ru/1867983/2025-04-09/ekspert-nazval-posledstviia-udarov-vsu-po-energetike-rf-dlia-potrebitelei-v-evrope,https://iz.ru/export/google/amp/1867983,Эксперт назвал последствия ударов ВСУ по энергетике РФ для потребителей в Европе,20250409T143000Z,http://cdn.iz.ru/sites/default/files/styles/900x506/public/news-2025-04/0d724c63b6ba414785e484b566f31d594d76096f.jpg?itok=vRqvE_hP,iz.ru,Russian,Russia,AFFECT,Emotional affect and sentiment
https://tass.ru/politika/23789715,https://tass.ru/politika/23789715/amp,Депутат Шеремет : Зеленский не сможет повлиять на мнение Трампа о Крыме,20250426T080000Z,https://cdn-storage-media.tass.ru/thumb/ru/politika/23789715?u=2025-04-26T05:04:32.789167,tass.ru,Russian,Russia,AFFECT,Emotional affect and sentiment
https://ria.ru/20250415/tramp-2011372524.html,https://ria.ru/amp/20250415/tramp-2011372524.html,"Трамп не сможет повлиять на отношения России и Китая , заявил посол КНР",20250415T123000Z,https://cdnn21.img.ria.ru/images/sharing/article/2011372524.jpg,ria.ru,Russian,Russia,AFFECT,Emotional affect and sentiment
https://charter97.org/ru/news/2025/4/14/636913/,https://qmt6jx.c97.org/ru/news/2025/4/14/636913/,"Ученые рассказали , как деньги влияют на брак",20250414T091500Z,https://i.c97.org/ai/267239/aux-head-1509038559-miliard_360.jpg,charter97.org,Russian,Belarus,AFFECT,Emotional affect and sentiment
https://vesti-ua.net/novosti/politika/264873-kak-peregovory-vliyayut-na-moralnoe-sostoyanie-voennyh-otvet-bileckogo.html,https://vesti-ua.net/novosti/politika/amp/264873-kak-peregovory-vliyayut-na-moralnoe-sostoyanie-voennyh-otvet-bileckogo.html,Как переговоры влияют на моральное состояние военных : ответ Билецкого,20250330T113000Z,https://vesti-ua.net/uploads/posts/2025-03/1743268386_bileckiy.jpg,vesti-ua.net,Russian,Ukraine,AFFECT,Emotional affect and sentiment
https://tass.ru/ekonomika/23763967,https://tass.ru/ekonomika/23763967/amp,ФАС : сделка по покупке  Яндексом  Boxberry не повлияет на конкуренцию,20250423T174500Z,https://cdn-storage-media.tass.ru/thumb/ru/ekonomika/23763967?u=2025-04-23T17:21:07.650768,tass.ru,Russian,Russia,AFFECT,Emotional affect and sentiment
https://24tv.ua/business/ru/novye-pravila-kitaja-po-chipam-mogut-povlijat-na-prodazhi-nvidia-biznes_n2784944,https://24tv.ua/business/ru/novye-pravila-kitaja-po-chipam-mogut-povlijat-na-prodazhi-nvidia-biznes_n2784944/amp,Новые правила Китая по чипам могут повлиять на продажи Nvidia,20250329T173000Z,https://24tv.ua/resources/photos/news/202503/2784944.jpg?v=1742994066000,24tv.ua,Russian,Ukraine,AFFECT,Emotional affect and sentiment
https://lenta.ru/news/2025/04/17/v-gosdume-prigrozili-germanii-zhestkim-otvetom-za-postavki-taurus-ukraine/,https://lenta.ru/news/2025/04/17/v-gosdume-prigrozili-germanii-zhestkim-otvetom-za-postavki-taurus-ukraine/amp/,В Госдуме пригрозили Германии жестким ответом за поставки Taurus Украине,20250416T190000Z,,lenta.ru,Russian,Russia,AFFECT,Emotional affect and sentiment
https://tass.ru/politika/23790981,https://tass.ru/politika/23790981/amp,  Авантюра киевского режима полностью провалилась . Путин о Курской области,20250426T113000Z,https://cdn-storage-media.tass.ru/thumb/ru/politika/23790981?u=2025-04-26T10:44:26.732246,tass.ru,Russian,Russia,AFFECT,Emotional affect and sentiment
https://www.m24.ru/shows1/166/790192,https://www.m24.ru/amp/shows1/166/790192,  Деньги 24 . Итоги : как торговая война США и Китая повлияет на экономику мира,20250419T144500Z,https://www.m24.ru/b/d/nBkSUhL2h1EhnMe1ILmL5pql29q06p-80mnBnvmDoGuQYX7XByXLjCdwu5tI-BaO-42NvWWBK8AqGfS8kjIzIymM8G1N_xHb1A=51RyZT78oDzLbLs75ksupQ.jpg,m24.ru,Russian,Russia,AFFECT,Emotional affect and sentiment
https://argumenti.ru/politics/2025/04/947939,https://argumenti.ru/politics/2025/04/947939/amp,В ЗСК предложили усовершенствовать законодательство об обеспечении жильём лиц с ограниченными возможностями здоровья,20250424T223000Z,https://img.argumenti.ru/news/news_id/20250424050039-947939.jpg,argumenti.ru,Russian,Russia,LEGISLATION,Legislative and legal themes
https://klops.ru/kaliningrad/2025-04-22/355087-ot-aresta-do-zapreta-v-kaliningrade-vynesli-meru-presecheniya-17-figurantam-dela-o-podpolnyh-bordelyah,,От ареста до запрета : в Калининграде вынесли меру пресечения 17 фигурантам дела о подпольных борделях,20250423T144500Z,,klops.ru,Russian,Russia,ARREST,Arrests and detentions
https://www.bfm.ru/news/571233,https://www.bfm.ru/amp/news/571233,Главу Гагаузии Евгению Гуцул перевели под домашний арест,20250409T223000Z,,bfm.ru,Russian,Russia,ARREST,Arrests and detentions
https://www.newsru.co.il/israel/22apr2025/sud_701.html,https://www.newsru.co.il/israel/22apr2025/sud_701.html/amp/,Суд распорядился освободить фигурантов дела  Катаргейт  из - под домашнего ареста,20250422T171500Z,https://images.newsru.co.il/l/227/26/2272687.jpg?cb=1745337557,newsru.co.il,Russian,Israel,ARREST,Arrests and detentions
https://www.interfax.ru/russia/1022337,https://www.interfax.ru/amp/1022337,Приставы возбудили исполнительное производство об аресте активов Чубайса,20250423T143000Z,https://www.interfax.ru/aspimg/1022337.jpg,interfax.ru,Russian,Russia,ARREST,Arrests and detentions
https://tass.ru/proisshestviya/23741773,https://tass.ru/proisshestviya/23741773/amp,Журналистка Барабаш скрылась из - под домашнего ареста,20250421T184500Z,https://cdn-storage-media.tass.ru/thumb/ru/proisshestviya/23741773?u=2025-04-21T18:04:07.416454,tass.ru,Russian,Russia,ARREST,Arrests and detentions
https://vz.ru/news/2025/4/9/1325008.html,https://vz.ru/amp/news/2025/4/9/1325008.html,ВЗГЛЯД / Гуцул перевели под домашний арест :: Новости дня,20250409T164500Z,https://img.vz.ru/upimg/soc/soc_1325008.jpg,vz.ru,Russian,Russia,ARREST,Arrests and detentions
https://www.interfax.ru/russia/1022326,https://www.interfax.ru/amp/1022326,Мосгорсуд признал законным арест основателя  Русагро  Мошковича,20250423T131500Z,https://www.interfax.ru/aspimg/1022326.png,interfax.ru,Russian,Russia,ARREST,Arrests and detentions
https://vm.ru/news/1224132-sud-prodlil-domashnij-arest-blogershe-mitroshinoj-obvinyaemoj-v-neuplate-nalogov,https://vm.ru/news/1224132-sud-prodlil-domashnij-arest-blogershe-mitroshinoj-obvinyaemoj-v-neuplate-nalogov/amp,"Суд продлил домашний арест блогерше Митрошиной , обвиняемой в неуплате налогов",20250423T091500Z,https://vm.ru/img/vmru_cover.png,vm.ru,Russian,Russia,ARREST,Arrests and detentions
https://ura.news/news/1052923408,{{ (metaService && metaService.ampUrl()) ? metaService.ampUrl() : https://amp.ura.news/news/1052923408 }},Выдача МУС ордера на арест Путина : мнение Медведева,20250424T061500Z,https://s.ura.news/images/news/figures/86/623/47a7d7b8-e2aa-44da-9a31-eb07fb5f211e/0mnbjx/L-1200.1.9.jpg,ura.news,Russian,Russia,ARREST,Arrests and detentions
https://russian.rt.com/russia/news/1468552-sud-domashnii-arest-mitroshina,https://russian.rt.com/russia/news/1468552-sud-domashnii-arest-mitroshina/amp,"Суд продлил домашний арест блогеру Митрошиной , обвиняемой в отмывании денег",20250423T093000Z,https://mf.b37mrtl.ru/russian/images/2025.04/article/6808a9cb02e8bd52da1c50a7.png,russian.rt.com,Russian,Russia,ARREST,Arrests and detentions
https://vse42.ru/news/33612614,https://vse42.ru/amp/news/33612614,Московский суд продлил домашний арест блогеру Александре Митрошиной,20250423T103000Z,,vse42.ru,Russian,Russia,ARREST,Arrests and detentions
https://tass.ru/obschestvo/23687123,https://tass.ru/obschestvo/23687123/amp,Двум избирательным участкам в Татарстане присвоили имена погибших участников СВО,20250415T100000Z,https://cdn-storage-media.tass.ru/thumb/ru/obschestvo/23687123?u=2025-04-15T09:23:04.629637,tass.ru,Russian,Russia,ELECTION,Election-related themes
